{
  "$schema": "https://json-schema.org/draft/2020-12/schema",
  "$id": "prompt.choice_requested",
  "type": "object",
  "required": ["type", "eventId", "createdAt", "threadId", "prompt", "choices", "timeoutSec"],
  "properties": {
    "type": { "const": "prompt.choice_requested" },
    "eventId": { "type": "string", "minLength": 1 },
    "createdAt": { "type": "string", "minLength": 1 },
    "threadId": { "type": "string", "minLength": 1 },
    "prompt": { "type": "string", "minLength": 1 },
    "choices": {
      "type": "array",
      "minItems": 1,
      "maxItems": 3,
      "items": {
        "type": "object",
        "required": ["id", "label"],
        "properties": {
          "id": { "type": "string", "minLength": 1 },
          "label": { "type": "string", "minLength": 1 }
        }
      }
    },
    "timeoutSec": { "type": "integer", "minimum": 1, "maximum": 3600 }
  }
}
